{"$id":"urn:lumi:lab:nml:cards:v1","$schema":"https://json-schema.org/draft/2020-12/schema","items":{"additionalProperties":false,"properties":{"age_max":{"maximum":120,"minimum":4,"type":"integer"},"age_min":{"maximum":120,"minimum":4,"type":"integer"},"effects":{"items":{"enum":["knowledge_candidate","relationship_candidate","resource_candidate","obligation_candidate"],"type":"string"},"maxItems":4,"minItems":0,"type":"array","uniqueItems":true},"extraction_id":{"maxLength":30,"minLength":1,"type":"string"},"family":{"enum":["epistemic","cooperation","ethical","resource","identity","legacy"],"type":"string"},"id":{"pattern":"^NM-[0-9]{3}$","type":"string"},"provenance":{"additionalProperties":false,"properties":{"author_kind":{"const":"ASSISTANT_MANUAL_PROPOSAL"},"human_review":{"const":"PENDING"},"method":{"const":"READ_FROZEN_SUMMARY_AND_ABSTRACT"},"provider_calls":{"const":0},"semantic_accuracy":{"const":"NOT_CERTIFIED"},"source_content_is_age_rating":{"const":false}},"required":["author_kind","method","human_review","semantic_accuracy","source_content_is_age_rating","provider_calls"],"type":"object"},"requires":{"items":{"enum":["observation","cooperation","local_rules","consent","limited_resources","recorded_history","distinct_perspectives"],"type":"string"},"maxItems":7,"minItems":1,"type":"array","uniqueItems":true},"reveal_level":{"maximum":2,"minimum":0,"type":"integer"},"risks":{"items":{"enum":["mild_peril","loss","ethical_conflict","identity_uncertainty"],"type":"string"},"maxItems":4,"minItems":0,"type":"array","uniqueItems":true},"source_group":{"enum":["sg1","atlantis"],"type":"string"},"source_ids":{"items":{"pattern":"^(sg1|atlantis):S[0-9]{2}E[0-9]{2}$","type":"string"},"maxItems":5,"minItems":1,"type":"array","uniqueItems":true},"status":{"enum":["PROPOSED_LAB","WITHHELD"],"type":"string"},"withheld_reason":{"maxLength":400,"minLength":0,"type":"string"}},"required":["id","status","family","age_min","age_max","risks","requires","effects","reveal_level","source_ids","source_group","extraction_id","provenance","withheld_reason"],"type":"object"},"maxItems":20,"minItems":15,"type":"array","uniqueItems":true}
