[{"age_max":120,"age_min":10,"effects":["relationship_candidate"],"extraction_id":"EX-001","family":"ethical","id":"NM-001","provenance":{"author_kind":"ASSISTANT_MANUAL_PROPOSAL","human_review":"PENDING","method":"READ_FROZEN_SUMMARY_AND_ABSTRACT","provider_calls":0,"semantic_accuracy":"NOT_CERTIFIED","source_content_is_age_rating":false},"requires":["consent","distinct_perspectives"],"reveal_level":1,"risks":["ethical_conflict"],"source_group":"sg1","source_ids":["sg1:S01E08"],"status":"PROPOSED_LAB","withheld_reason":""},{"age_max":120,"age_min":7,"effects":["knowledge_candidate"],"extraction_id":"EX-002","family":"resource","id":"NM-002","provenance":{"author_kind":"ASSISTANT_MANUAL_PROPOSAL","human_review":"PENDING","method":"READ_FROZEN_SUMMARY_AND_ABSTRACT","provider_calls":0,"semantic_accuracy":"NOT_CERTIFIED","source_content_is_age_rating":false},"requires":["limited_resources","cooperation"],"reveal_level":1,"risks":["mild_peril"],"source_group":"sg1","source_ids":["sg1:S01E11"],"status":"PROPOSED_LAB","withheld_reason":""},{"age_max":120,"age_min":10,"effects":["relationship_candidate","obligation_candidate"],"extraction_id":"EX-003","family":"ethical","id":"NM-003","provenance":{"author_kind":"ASSISTANT_MANUAL_PROPOSAL","human_review":"PENDING","method":"READ_FROZEN_SUMMARY_AND_ABSTRACT","provider_calls":0,"semantic_accuracy":"NOT_CERTIFIED","source_content_is_age_rating":false},"requires":["consent","cooperation"],"reveal_level":1,"risks":["ethical_conflict"],"source_group":"sg1","source_ids":["sg1:S01E16"],"status":"PROPOSED_LAB","withheld_reason":""},{"age_max":120,"age_min":10,"effects":["relationship_candidate"],"extraction_id":"EX-004","family":"ethical","id":"NM-004","provenance":{"author_kind":"ASSISTANT_MANUAL_PROPOSAL","human_review":"PENDING","method":"READ_FROZEN_SUMMARY_AND_ABSTRACT","provider_calls":0,"semantic_accuracy":"NOT_CERTIFIED","source_content_is_age_rating":false},"requires":["consent","local_rules"],"reveal_level":1,"risks":["ethical_conflict"],"source_group":"sg1","source_ids":["sg1:S01E17"],"status":"PROPOSED_LAB","withheld_reason":""},{"age_max":120,"age_min":7,"effects":["knowledge_candidate"],"extraction_id":"EX-005","family":"epistemic","id":"NM-005","provenance":{"author_kind":"ASSISTANT_MANUAL_PROPOSAL","human_review":"PENDING","method":"READ_FROZEN_SUMMARY_AND_ABSTRACT","provider_calls":0,"semantic_accuracy":"NOT_CERTIFIED","source_content_is_age_rating":false},"requires":["observation","local_rules"],"reveal_level":1,"risks":["mild_peril"],"source_group":"sg1","source_ids":["sg1:S01E18"],"status":"PROPOSED_LAB","withheld_reason":""},{"age_max":120,"age_min":15,"effects":["relationship_candidate"],"extraction_id":"EX-006","family":"identity","id":"NM-006","provenance":{"author_kind":"ASSISTANT_MANUAL_PROPOSAL","human_review":"PENDING","method":"READ_FROZEN_SUMMARY_AND_ABSTRACT","provider_calls":0,"semantic_accuracy":"NOT_CERTIFIED","source_content_is_age_rating":false},"requires":["distinct_perspectives","consent"],"reveal_level":1,"risks":["identity_uncertainty"],"source_group":"sg1","source_ids":["sg1:S01E19"],"status":"PROPOSED_LAB","withheld_reason":""},{"age_max":120,"age_min":10,"effects":["knowledge_candidate"],"extraction_id":"EX-007","family":"ethical","id":"NM-007","provenance":{"author_kind":"ASSISTANT_MANUAL_PROPOSAL","human_review":"PENDING","method":"READ_FROZEN_SUMMARY_AND_ABSTRACT","provider_calls":0,"semantic_accuracy":"NOT_CERTIFIED","source_content_is_age_rating":false},"requires":["consent","distinct_perspectives"],"reveal_level":1,"risks":["ethical_conflict"],"source_group":"sg1","source_ids":["sg1:S03E05"],"status":"WITHHELD","withheld_reason":"Final ve toplumsal değişim iddiası ayrıca doğrulanmalı; kart seçim dışı."},{"age_max":120,"age_min":10,"effects":["knowledge_candidate"],"extraction_id":"EX-008","family":"cooperation","id":"NM-008","provenance":{"author_kind":"ASSISTANT_MANUAL_PROPOSAL","human_review":"PENDING","method":"READ_FROZEN_SUMMARY_AND_ABSTRACT","provider_calls":0,"semantic_accuracy":"NOT_CERTIFIED","source_content_is_age_rating":false},"requires":["cooperation","recorded_history"],"reveal_level":1,"risks":["loss"],"source_group":"sg1","source_ids":["sg1:S04E06"],"status":"PROPOSED_LAB","withheld_reason":""},{"age_max":120,"age_min":10,"effects":["knowledge_candidate"],"extraction_id":"EX-009","family":"resource","id":"NM-009","provenance":{"author_kind":"ASSISTANT_MANUAL_PROPOSAL","human_review":"PENDING","method":"READ_FROZEN_SUMMARY_AND_ABSTRACT","provider_calls":0,"semantic_accuracy":"NOT_CERTIFIED","source_content_is_age_rating":false},"requires":["limited_resources","cooperation"],"reveal_level":1,"risks":["mild_peril"],"source_group":"sg1","source_ids":["sg1:S02E15"],"status":"PROPOSED_LAB","withheld_reason":""},{"age_max":120,"age_min":7,"effects":["knowledge_candidate"],"extraction_id":"EX-010","family":"cooperation","id":"NM-010","provenance":{"author_kind":"ASSISTANT_MANUAL_PROPOSAL","human_review":"PENDING","method":"READ_FROZEN_SUMMARY_AND_ABSTRACT","provider_calls":0,"semantic_accuracy":"NOT_CERTIFIED","source_content_is_age_rating":false},"requires":["cooperation","local_rules"],"reveal_level":1,"risks":["mild_peril"],"source_group":"atlantis","source_ids":["atlantis:S01E04"],"status":"PROPOSED_LAB","withheld_reason":""},{"age_max":120,"age_min":7,"effects":["knowledge_candidate","relationship_candidate"],"extraction_id":"EX-011","family":"epistemic","id":"NM-011","provenance":{"author_kind":"ASSISTANT_MANUAL_PROPOSAL","human_review":"PENDING","method":"READ_FROZEN_SUMMARY_AND_ABSTRACT","provider_calls":0,"semantic_accuracy":"NOT_CERTIFIED","source_content_is_age_rating":false},"requires":["observation","consent"],"reveal_level":1,"risks":[],"source_group":"atlantis","source_ids":["atlantis:S01E05"],"status":"PROPOSED_LAB","withheld_reason":""},{"age_max":120,"age_min":10,"effects":["knowledge_candidate"],"extraction_id":"EX-012","family":"epistemic","id":"NM-012","provenance":{"author_kind":"ASSISTANT_MANUAL_PROPOSAL","human_review":"PENDING","method":"READ_FROZEN_SUMMARY_AND_ABSTRACT","provider_calls":0,"semantic_accuracy":"NOT_CERTIFIED","source_content_is_age_rating":false},"requires":["observation","local_rules"],"reveal_level":1,"risks":["ethical_conflict"],"source_group":"atlantis","source_ids":["atlantis:S01E06"],"status":"PROPOSED_LAB","withheld_reason":""},{"age_max":120,"age_min":15,"effects":["obligation_candidate"],"extraction_id":"EX-013","family":"ethical","id":"NM-013","provenance":{"author_kind":"ASSISTANT_MANUAL_PROPOSAL","human_review":"PENDING","method":"READ_FROZEN_SUMMARY_AND_ABSTRACT","provider_calls":0,"semantic_accuracy":"NOT_CERTIFIED","source_content_is_age_rating":false},"requires":["observation","consent","limited_resources"],"reveal_level":1,"risks":["ethical_conflict","loss"],"source_group":"atlantis","source_ids":["atlantis:S01E07"],"status":"PROPOSED_LAB","withheld_reason":""},{"age_max":120,"age_min":10,"effects":["relationship_candidate"],"extraction_id":"EX-014","family":"ethical","id":"NM-014","provenance":{"author_kind":"ASSISTANT_MANUAL_PROPOSAL","human_review":"PENDING","method":"READ_FROZEN_SUMMARY_AND_ABSTRACT","provider_calls":0,"semantic_accuracy":"NOT_CERTIFIED","source_content_is_age_rating":false},"requires":["cooperation","consent"],"reveal_level":1,"risks":["ethical_conflict"],"source_group":"atlantis","source_ids":["atlantis:S01E08"],"status":"PROPOSED_LAB","withheld_reason":""},{"age_max":120,"age_min":10,"effects":["knowledge_candidate","obligation_candidate"],"extraction_id":"EX-015","family":"ethical","id":"NM-015","provenance":{"author_kind":"ASSISTANT_MANUAL_PROPOSAL","human_review":"PENDING","method":"READ_FROZEN_SUMMARY_AND_ABSTRACT","provider_calls":0,"semantic_accuracy":"NOT_CERTIFIED","source_content_is_age_rating":false},"requires":["observation","consent"],"reveal_level":1,"risks":["ethical_conflict"],"source_group":"atlantis","source_ids":["atlantis:S01E09"],"status":"PROPOSED_LAB","withheld_reason":""},{"age_max":120,"age_min":10,"effects":["knowledge_candidate"],"extraction_id":"EX-016","family":"epistemic","id":"NM-016","provenance":{"author_kind":"ASSISTANT_MANUAL_PROPOSAL","human_review":"PENDING","method":"READ_FROZEN_SUMMARY_AND_ABSTRACT","provider_calls":0,"semantic_accuracy":"NOT_CERTIFIED","source_content_is_age_rating":false},"requires":["observation","local_rules"],"reveal_level":2,"risks":["mild_peril"],"source_group":"atlantis","source_ids":["atlantis:S01E13"],"status":"PROPOSED_LAB","withheld_reason":""},{"age_max":120,"age_min":10,"effects":["knowledge_candidate","obligation_candidate"],"extraction_id":"EX-017","family":"legacy","id":"NM-017","provenance":{"author_kind":"ASSISTANT_MANUAL_PROPOSAL","human_review":"PENDING","method":"READ_FROZEN_SUMMARY_AND_ABSTRACT","provider_calls":0,"semantic_accuracy":"NOT_CERTIFIED","source_content_is_age_rating":false},"requires":["recorded_history","observation"],"reveal_level":1,"risks":["loss"],"source_group":"atlantis","source_ids":["atlantis:S01E15"],"status":"PROPOSED_LAB","withheld_reason":""},{"age_max":120,"age_min":7,"effects":["knowledge_candidate"],"extraction_id":"EX-018","family":"resource","id":"NM-018","provenance":{"author_kind":"ASSISTANT_MANUAL_PROPOSAL","human_review":"PENDING","method":"READ_FROZEN_SUMMARY_AND_ABSTRACT","provider_calls":0,"semantic_accuracy":"NOT_CERTIFIED","source_content_is_age_rating":false},"requires":["local_rules","consent"],"reveal_level":1,"risks":[],"source_group":"atlantis","source_ids":["atlantis:S01E16"],"status":"PROPOSED_LAB","withheld_reason":""}]
